"from_id","from_name","message","created_time","likes_count","comments_count","id"
"850466145110772","Thiên Yết","ieu","2014-08-26T03:51:35+0000",0,0,"680330992053732_680701498683348"
"322655967821238","Closeup","ChiPi Tran và Supi Lun : nếu thích thì tham gia ngay đi nhé hai bạn ;) !!","2014-08-26T04:32:14+0000",1,0,"680330992053732_680710748682423"
"322655967821238","Closeup","Ku Kò KaKa nếu yêu rồi, thì còn chờ gì mà không cùng người ấy tham gia cuuộc thi đi nào !!","2014-08-26T04:33:00+0000",1,0,"680330992053732_680710962015735"
"897671400383020","Thay Đổi Cuộc Sống","Thi cũng thấy quà đâu","2014-08-26T04:37:54+0000",0,0,"680330992053732_680712032015628"
"1531992563506169","Grit Le","Tran Le Ha","2014-08-26T14:58:53+0000",0,0,"680330992053732_680938371992994"
"1910112635906718","Yến Nhi Nguyễn","Bách Nguyễn ne bun","2014-08-27T02:38:00+0000",0,0,"680330992053732_681182078635290"
"643787755825387","Khanh Trần","Hoàng Quyên làm phát gọi là đi zk :)","2014-08-27T03:27:32+0000",0,0,"680330992053732_681194305300734"
"1114424358688048","Thảo Ly","F cmn A... Thiên Phú","2014-08-27T05:06:22+0000",1,0,"680330992053732_681214868632011"
"1114424358688048","Thảo Ly","Thích cái áo quá... MI Như Ý.. m vs thèn #phương tham ja r mang áo về cho t","2014-08-27T05:08:22+0000",0,0,"680330992053732_681215178631980"
"1969380793301907","Sơn Ca","Chồng Của Vợ Anh chup kaj nay ne a","2014-08-27T05:41:00+0000",0,0,"680330992053732_681221868631311"
"1936919599857393","Huyền Đô","Yêu nhau là đc phải k ad
K phân biết giới tính ạ =))))))))))","2014-08-27T05:43:27+0000",1,0,"680330992053732_681222471964584"
"859944944159779","Tran Tran","Do Va Ta Lê Chi :))","2014-08-27T21:40:31+0000",1,0,"680330992053732_681514108602087"
"2031137423780762","Tuệ Cua","Chan dep day .","2014-08-27T21:40:58+0000",0,0,"680330992053732_681514245268740"
"1313609838751709","Lê Chi","Tran Tran,,,vụ gì zạ?","2014-08-28T02:14:39+0000",1,0,"680330992053732_681596561927175"
"1617272334992167","Truc Tran","Lâu lâu hẹn hò chút chơi. Nhỉ? Nhiem Tran #HẹnHoCungXfactor #Closeup #CircleKVietnam","2014-08-28T04:41:42+0000",1,0,"680330992053732_681629795257185"
"859944944159779","Tran Tran","Chụp hình ak Lê Chi","2014-08-28T09:45:44+0000",1,0,"680330992053732_681717218581776"
"322655967821238","Closeup","Huyền Đô thì bạn cứ bất chấp hết mọi thứ để yêu nhau đi bạn ơi ! ;)","2014-08-28T10:04:41+0000",2,0,"680330992053732_681721625248002"
"1286585681450656","Võ Thị Thêm","Kelly Bui m tham zu cai nay đi","2014-08-28T16:04:32+0000",0,0,"680330992053732_681839135236251"
"866595640157331","Hikigaya Hachiman","F.A ko thích điều này :vvv","2014-08-29T04:39:49+0000",0,0,"680330992053732_682127021874129"
"1973349886229909","Nobi Nobita","Dm suc mieg nhu dam vao mom","2014-08-29T08:59:36+0000",0,0,"680330992053732_682184545201710"
