"from_id","from_name","message","created_time","likes_count","comments_count","id"
"1950520155161542","Noi Kim Lý","khi nao moi co ban tren cac dai ly vay ad ??","2014-10-23T14:45:08+0000",0,0,"711874385566059_711953745558123"
"322655967821238","Closeup","KimNói Lý hiện Closeup Diamond Attraction đã có mặt tại hệ thông siêu thị Big C, CoopMart, Aeon Mall rồi nhé bạn :D","2014-10-24T07:51:31+0000",1,0,"711874385566059_712300335523464"
"744335199058647","Trung Quỳnh","giá cả bnhieu vậy ad","2014-10-25T07:01:02+0000",1,0,"711874385566059_712762052143959"
"1508238419239517","Ori On","gia bnhieu z ad","2014-10-27T07:20:18+0000",0,0,"711874385566059_713931498693681"
"322655967821238","Closeup","Thuý Quỳnh và Ori On Gía là 37,000vnd cho một hộp Closeup #DiamondAttraction nhé bạn ;) !","2014-10-27T10:25:02+0000",0,0,"711874385566059_713993745354123"
"10213051167335056","Trang Dương","Moi di coop hau giang ko thay co ban?","2014-10-28T10:06:42+0000",0,0,"711874385566059_714669355286562"
"1475667635830286","AnhThu Pham","ad oi,minh muon dat 10 tuyp ,ad co ban k ah? minh di sieu thi o toan vung tau luon nhung k thay co ban","2014-10-29T13:21:55+0000",0,0,"711874385566059_715216138565217"
