"from_id","from_name","message","created_time","likes_count","comments_count","id"
"1566058133456435","Nguyễn Hồng Nhung","Ad ơi. Hạn voucher của mình tới 20/2 lan. Mà ct 14/2 hết hạn rồi. Vậy mình có xài voucher đc k vậy ad","2017-02-19T03:50:33+0000",0,1,"1266893873397438_1272593019494190"
"1576691949069135","Lê Tính","Ad cho mình hỏi : event đăng ảnh trên page closeup trúng cặp vé xem phim free 1 năm khi nào kết thúc vậy?","2017-02-14T14:05:30+0000",0,3,"1266893873397438_1267025496717609"
"707562426101645","Ngọc Linh","Ad ơi cho e hỏi là vocher của e ko áp dụng mua hàng ở dingtea của bigc Long Biên vậy?","2017-02-14T12:32:45+0000",0,2,"1266893873397438_1266925256727633"
"860636304090829","Trinh Thi Tre","Ad ơi, hom nay còn lật bài được đg ko ad","2017-02-18T14:40:53+0000",0,1,"1266893873397438_1271967399556752"
"1362896533825916","Bear Ken","Spam vừa thôi trời, ko trúng thì buồn thấy mẹ thôi, đằng này ko những spam mà còn đăng hình thằng thắng vô mess chi làm mắc công mỡ lên coi, ... vớ vẩn","2017-02-16T16:46:01+0000",1,0,"1266893873397438_1269457846474374"
"1035786886555843","Trọng Phú Trọng Lê","Thánh ngàn nick hiển linh :))","2017-02-14T13:21:24+0000",2,0,"1266893873397438_1266969810056511"
"705570576320474","Hoàng Anh","Ad ơi kiểm tra lại, giải thưởng chưa gửi lại là sao @@","2017-02-24T11:39:31+0000",0,0,"1266893873397438_1278423235577835"
"705570576320474","Hoàng Anh","ad ơi vẫn chưa gửi lại cho e :(","2017-02-22T06:03:19+0000",0,0,"1266893873397438_1276170859136406"
