"from_id","from_name","message","created_time","likes_count","comments_count","id"
"865086333660676","Nguyễn Trọng QuỐc","Trịnh Ngô Đoan chụp klo? dk đồ đó","2014-09-05T14:59:32+0000",0,0,"685420711544760_685864031500428"
"1939383946275469","Vy Elisa","Đặng Quốc Thắng <3","2014-09-05T16:50:46+0000",0,0,"685420711544760_685908778162620"
"2085910494969588","Linh Vo Cam","Tran Nguyen Thanh tham ja k ck","2014-09-05T16:55:13+0000",1,0,"685420711544760_685910254829139"
"863890580430223","Nguyễn Hoàng Thái Phương","giờ chưa có kết quả tuần 3 hả ad","2014-09-06T05:51:58+0000",0,0,"685420711544760_686145854805579"
"322655967821238","Closeup","Dom Diesel nhanh chân lên nào bạn ơi !! ;) Chỉ còn vài ngày nữa thôi là cuộc thi của tuần 3 kết thúc rồi !!! Tối nay rãnh tiện đi chơi Trung thu rồi chụp hình luôn nhé !","2014-09-08T03:19:42+0000",0,0,"685420711544760_687039254716239"
"322655967821238","Closeup","Linh Vo Cam và Tran Nguyen Thanh: hôm nay Trung thu, các bạn cùng nhau chụp hình tạo dáng đi nào !!","2014-09-08T03:20:50+0000",0,0,"685420711544760_687039621382869"
"322655967821238","Closeup","Thái Phương kết quả tuần 3 đã có rồi nhé các bạn ! ;)","2014-09-08T03:21:08+0000",0,0,"685420711544760_687039764716188"
"1939383946275469","Vy Elisa","Advơi,mình gửi hình ngày hôm qa 7.9 là thuộc tuần 3 hay tuần 4 hả Ad","2014-09-08T05:16:23+0000",0,0,"685420711544760_687065488046949"
"322655967821238","Closeup","@vy Elisa sẽ được tình là thuộc tuần thứ 4 nhé bạn :)","2014-09-08T07:01:43+0000",1,0,"685420711544760_687088621377969"
