"from_id","from_name","message","created_time","likes_count","comments_count","id"
"1873085872946335","Linh Linh Pas","M la thag diien,cu pin na","2014-11-22T11:53:57+0000",1,0,"726180620802102_727806053972892"
"1948049078803983","Nguyễn Thị Dung","Chuc moi nguoi mot ngay cuoi thuan vui ve","2014-11-22T13:07:30+0000",0,0,"726180620802102_727829873970510"
"1899116870348205","Thuy Le","dug la wa ranh","2014-11-24T18:11:57+0000",0,0,"726180620802102_729061223847375"
"1964522493805934","Lự Trịnh","Toi yeu dat nuoc viet nam,toi yeu con nguoi viet nam.nhung toi khong dong tinh ve viec ...........!trung quoc","2014-11-25T05:35:54+0000",0,0,"726180620802102_729322093821288"
"1911555475753102","Thuy Yonhy Ho","Vây a","2014-11-25T08:15:20+0000",0,0,"726180620802102_729356270484537"
"1950610421891356","Phương Lê Thi","Đăng anh minh lên đâu đê dư thi nhi.","2014-11-28T08:00:18+0000",0,0,"726180620802102_730915376995293"
