"from_id","from_name","message","created_time","likes_count","comments_count","id"
"814981022004042","Lịch Nguyễn","Closeup oi trong the le thay ghi 2 giai nhi ma, sao minh moi thay co 1 giai nh vay
•      Giải Nhất: Trọn bộ sưu tập Xfactor và 1 cặp vé tham dự Liveshow Nhân Tố Bí Ẩn dành cho bài dự thi sáng tạo nhất. 
•      2 giải nhì: 2 cặp balo đeo lưng sành điệu cùng 2 cặp vé tham dự Liveshow Nhân Tố Bí Ẩn.","2014-08-29T13:30:01+0000",0,0,"682204068533091_682257888527709"
"863890580430223","Nguyễn Hoàng Thái Phương","Ad oi, gui anh du thi vao muc nao vay???","2014-08-30T16:27:18+0000",0,0,"682204068533091_682733655146799"
"322655967821238","Closeup","Thái Phương Bạn có thể post lên tường của Closeup nhé, kèm theo #HenHoCungXfactor #Closeup và #CircleKVietnam","2014-08-30T18:44:21+0000",0,0,"682204068533091_682778521808979"
"322655967821238","Closeup","Lịch Nguyễn Cám ơn bạn! Do sơ suất nên Closeup công bố thiếu 1 giải nhì. Closeup đã bổ sung nhé bạn. Nếu bạn đã tham gia cuộc thi, và là 1 trong 10 người nhanh nhất, thì hãy liên hê Closeup đê nhận mời xem Nhân Tố Bí Ẩn nhé ! :)","2014-08-30T18:51:36+0000",0,0,"682204068533091_682780221808809"
"10155486067877567","Mi Ngoan Doan","Close up ơi, nhận quà thế nào nhỉ.  :)","2014-09-02T19:02:59+0000",0,0,"682204068533091_684209188332579"
