"from_id","from_name","message","created_time","likes_count","comments_count","id"
"1916955885218851","Bảo Nguyễn","Có","2015-01-03T12:19:19+0000",0,0,"749004818519682_751792264907604"
"871400636347880","Dim Ha","coooó...","2015-01-04T06:12:16+0000",0,0,"749004818519682_752333691520128"
"1917552708518327","Văn Nguyễn","sao mình vào siêu thị bigc  ko có la sao nhỉ ?","2015-01-04T08:01:12+0000",0,0,"749004818519682_752372814849549"
"968800509938925","Nhỏ Hương","Em k tìm thấy trên thị trường vậy ??","2015-01-04T14:50:49+0000",0,0,"749004818519682_752686844818146"
"968800509938925","Nhỏ Hương","Kei <3","2015-01-04T14:51:34+0000",1,0,"749004818519682_752687068151457"
"322655967821238","Closeup","Fan Closeup ơi, Diamond Attraction giá 37k, hiện được có bán tại tất cả hệ thống siêu thị trên toàn quốc nhé bạn  :D","2015-01-06T02:30:23+0000",3,3,"749004818519682_753551651398332"
"1895201434073666","Poinciana Autumn","Các vùng lân cận có không vậy? Nôn mua được nó ghê","2015-01-08T13:53:27+0000",0,0,"749004818519682_755691867850977"
"1104961802938552","Xiao Long","co ban ship hag den tan nha k closeuphttps://www.facebook.com/closeupvn.page","2015-02-13T11:24:43+0000",0,0,"749004818519682_773927846027379"
