"from_id","from_name","message","created_time","likes_count","comments_count","id"
"322655967821238","Closeup","Duy Nguyen Hong giá tai nghe vào tầm khoảng 500k nhé bạn :) !","2014-08-11T06:51:56+0000",1,0,"672734949480003_673812189372279"
"2097435693817220","Thế Vinh","A du","2014-08-11T12:14:12+0000",0,0,"672734949480003_673920786028086"
"1976160102668793","Lông Chi Hiếu","A","2014-08-11T12:56:50+0000",0,0,"672734949480003_673939379359560"
"1385334884853542","Ny Nguyễn","hông có người yêu thì thế lào :))","2014-08-11T12:57:18+0000",0,0,"672734949480003_673939536026211"
"1098344530310437","Dung Vũ Bsls","ko co ny de chup cug hjhj","2014-08-11T13:23:56+0000",0,0,"672734949480003_673949982691833"
"1098344530310437","Dung Vũ Bsls","Nam Trần Hoài a gui anh a voi ny thj caj nj.dj hjhj","2014-08-11T13:24:41+0000",0,0,"672734949480003_673950192691812"
"730774687107470","chiềuđáốngbơ sángnhậtlá","Dep","2014-08-11T16:11:57+0000",0,0,"672734949480003_674018012685030"
"1937542309821969","Vân Hà","Tkj j do","2014-08-11T23:09:41+0000",0,0,"672734949480003_674163982670433"
"833101196841690","Dung Dungkheo Vu Nghoc","Dt di vai gia bao nhieu tien vai ad","2014-08-12T00:42:49+0000",0,0,"672734949480003_674196919333806"
"1405749639460888","Van Anh","Sói Sa Đọa này :D","2014-08-12T03:12:30+0000",1,0,"672734949480003_674247389328759"
"1410592852389775","An Phan Rang","xếp hình vs gấu Up lên là rinh giải nhất ngay á mà :v :v :v","2014-08-12T03:51:13+0000",1,0,"672734949480003_674258759327622"
"322655967821238","Closeup","Ny Ssi nếu không có nguời yêu thì bạn vẫn có thể chụp chung với bạn khác giới của mình nhé ! ;)","2014-08-12T04:06:38+0000",0,0,"672734949480003_674262729327225"
"1197083070435326","Mỹ Linh","Ts chỉ có ở tp hcm :o","2014-08-12T04:30:15+0000",1,0,"672734949480003_674268845993280"
"698126827038655","Chiến Nhi","Có ai chụp chung hok ta","2014-08-12T04:39:36+0000",1,0,"672734949480003_674271162659715"
"1972336906377883","Tuấn TiTis","Ckak han la co day...?","2014-08-12T05:16:13+0000",1,0,"672734949480003_674280182658813"
"1488125094566469","Dương Minh","Ninh Phan tham gia hèo :3","2014-08-12T07:16:05+0000",3,0,"672734949480003_674311319322366"
"322655967821238","Closeup","Trơ Như Nitơ đúng rồi bạn ơi, chỉ chấp nhận thí sinh ở Tp HCM thôi nhé :)","2014-08-12T07:22:55+0000",1,0,"672734949480003_674313269322171"
"760285440817897","Dũng Trần","0","2014-08-12T11:25:58+0000",0,0,"672734949480003_674384919315006"
"647813148758217","Tỹ SOái","đt hjêu j?gjá bao nhju trên thj truog za?","2014-08-12T12:39:01+0000",0,0,"672734949480003_674402082646623"
"1941796719423812","Đa Đa","Ker Kendy","2014-08-12T14:16:48+0000",0,0,"672734949480003_674452139308284"
"814782055365578","Ker Kendy","Để xem đã. Hehe","2014-08-12T14:17:46+0000",0,0,"672734949480003_674452475974917"
"1941796719423812","Đa Đa","Chụp ko Ker Kendy.vô link đọc đy","2014-08-12T14:20:49+0000",0,0,"672734949480003_674453342641497"
"2055234148081005","Vu Phong James","Khuya ui di ngu thui cac p oi?","2014-08-12T14:36:04+0000",0,0,"672734949480003_674459085974256"
"1992697424295236","Bùi Thanh Tùng","Phét là gjỏj!","2014-08-12T14:45:28+0000",1,0,"672734949480003_674462565973908"
"1966490253632597","Mua Sao Bang","Haha o dau day a tung oj sao e khog ngke tkay zay a co 1djem rat dak px ns ma e co tkay a thuk hah dau dug k hjhjhj co thj phone laj cko e nke.","2014-08-12T15:21:36+0000",0,0,"672734949480003_674474475972717"
"1897210683873112","Khôngchínsáubốn Bảykhônghai Basáubảy","Phuong Trung gui ảnh ny mà nhận quà tề","2014-08-12T15:24:25+0000",0,0,"672734949480003_674475762639255"
"1990934744472076","Phan Thị Hoài Phượng","Anh cho e muon anh cai","2014-08-12T15:26:03+0000",0,0,"672734949480003_674476375972527"
"1897210683873112","Khôngchínsáubốn Bảykhônghai Basáubảy","Đấy...lấy đi...đk quà chia a vs...hjhjPhuong Trung","2014-08-12T15:27:06+0000",0,0,"672734949480003_674476809305817"
"1983529095261747","Triệu Yên","Lấy gầu hot lun.:-D","2014-08-12T16:05:23+0000",0,0,"672734949480003_674490262637805"
"675465242644803","Duy Hà Bùi","FA thì biết làm thế nào đây :(((","2014-08-12T17:28:08+0000",0,0,"672734949480003_674525305967634"
"1920198124887935","Linh Phạm","Hí Hài Hước","2014-08-12T20:06:32+0000",0,0,"672734949480003_674579765962188"
"695090724014869","Chim Kí Ức Trong","Cok thek thok sa0  @@ hjhj","2014-08-13T01:11:06+0000",0,0,"672734949480003_674684085951756"
"1943676525920433","Mai Phạm","Huyen maj nek","2014-08-13T01:15:25+0000",0,0,"672734949480003_674685495951615"
