"from_id","from_name","message","created_time","likes_count","comments_count","id"
"1901904210051904","Xuân Nguyễn","Mình đã tham gia rồi nhé. ..","2014-11-13T14:01:18+0000",0,0,"721614194592078_723397781080386"
"1625218074163846","Nguyễn Trinh","Nhi Nguyen, tham gia đii! :3","2014-11-13T17:41:15+0000",0,0,"721614194592078_723486387738192"
"1492910850789779","Ngoc Huyen Le","Tham gia bằng cách nào vậy bạn?","2014-11-13T18:25:29+0000",3,0,"721614194592078_723504901069674"
"1392981697403685","Hai Phan","Chấm bằng LIKE thì mình ko tham gia là cái chắc roài!","2014-11-14T00:03:06+0000",0,0,"721614194592078_723621507724680"
"1551052744916989","Hà Phương","mình muốn tham gia bằng cách nào vậy bạn","2014-11-14T02:13:43+0000",0,0,"721614194592078_723658301054334"
"850391195114231","Kim Thoa Huynh","Minh cug muon tham gia","2014-11-14T03:36:51+0000",0,0,"721614194592078_723683687718462"
"322655967821238","Closeup","http://bit.ly/IntheSpotlightSnow Thể lệ tham gia tại đây nhé các bạn :)","2014-11-14T07:47:53+0000",1,0,"721614194592078_723744434379054"
"1079283188870177","Huyen Quach","Minh cug the","2014-11-14T15:42:40+0000",1,0,"721614194592078_723913157695515"
"1934802273429346","Trần Thị Thu Hiền","chup anh nhin xinhgai ko nhan ra","2014-11-14T15:54:36+0000",1,0,"721614194592078_723917087695122"
"1913867008868905","Thi Tin LE","doi nghe roi ha ey","2014-11-15T00:02:01+0000",1,0,"721614194592078_724159754337522"
"1917603388507002","Them Nguyen","tai minh k tu tin lam","2014-11-15T02:57:50+0000",1,0,"721614194592078_724204547666376"
"691613327694145","Mai Vân Nguyễn","Dc oj.e lam co dc k","2014-11-15T04:59:19+0000",1,0,"721614194592078_724241600996004"
"645955965598876","Thảo Anh","Cho minh tham gia voi moi nguoi oi...hihi","2014-11-15T10:05:06+0000",1,0,"721614194592078_724323504321147"
"645955965598876","Thảo Anh","Minh ko biet lam cach nao de tham gia day ne.chi cho minh voi nhe","2014-11-15T10:05:57+0000",1,0,"721614194592078_724323737654457"
"707747852750087","Trâm Hoa","Tham gia thôi,mọi người ơi,!","2014-11-15T13:32:01+0000",1,0,"721614194592078_724401330980031"
"863740757126965","Bùi Thảo Bui Thảo","có mình áo vàng kia, mà vẫn chưa có giải hic","2014-11-15T13:43:50+0000",1,0,"721614194592078_724405264312971"
"863740757126965","Bùi Thảo Bui Thảo","chấm giải mà dựa vào tiêu chí like và share thì mình chịu rồi!!","2014-11-15T13:54:50+0000",1,0,"721614194592078_724409230979241"
"873836329450495","Nghi Phuong","Hàng Gì Cũng Có","2014-11-15T15:31:34+0000",1,0,"721614194592078_724457900974374"
"1373743506073077","Mếu Còi","Cho minhg hỏi sản phẩm này có bán tại đâu nhỉ?","2014-11-16T00:57:07+0000",1,0,"721614194592078_724644050955759"
"801509403360803","Nghiêm Thị Huệ","Dien vien Dien ah a cau oi","2014-11-16T01:51:59+0000",1,0,"721614194592078_724657744287723"
"850993655064806","Thìn Julia","muon tau be ha...","2014-11-16T03:17:40+0000",0,0,"721614194592078_724681514285346"
"657890064408349","Bich Pham Thi","Mình nguong mộ quá","2014-11-16T10:46:56+0000",0,0,"721614194592078_724814124272085"
"322655967821238","Closeup","http://bit.ly/IntheSpotlightSnow  các bạn hãy nhớ tham gia cuộc thi tại đây nhé :)","2014-11-16T23:51:40+0000",0,0,"721614194592078_725099297576901"
"1918255245114420","Hang Le","Mình muôn tham gia nhung van chua hiểu cách. Chụp ảnh roi gửi vào trang web nào hay vào trang web của closeup truoc vậy bạn.","2014-11-17T13:09:48+0000",0,0,"721614194592078_725345204218977"
"322655967821238","Closeup","Hang Le thể lệ chi tiết bạn đọc tại đây nha  http://bit.ly/IntheSpotlightSnow","2014-11-18T09:01:22+0000",2,0,"721614194592078_725771380843026"
"1980435438857816","Hue Phan","Closeup oi e kg bjt su dung may tinh e kg hieu","2014-11-19T12:02:37+0000",0,0,"721614194592078_726327567454074"
"2077002692527347","Lan Hana","Tâm Tỉnh Bắc","2014-11-21T12:31:15+0000",1,0,"721614194592078_727338587352972"
