"from_id","from_name","message","created_time","likes_count","comments_count","id"
"820719838077970","Huyền Hoàng","rất ấn tượng anh này hát bài it will rain <3 Loki Bảo Long","2014-07-18T12:36:58+0000",1,0,"660542767365888_662114537208711"
"1538661609512099","Thương Trần","<3 anh này hát nghe chất","2014-07-18T12:41:53+0000",1,0,"660542767365888_662115947208570"
"708700912660615","An Đặng","đa phong cách","2014-07-18T12:43:56+0000",1,0,"660542767365888_662116623875169"
"322655967821238","Closeup","Huyền Lucy ThươngThương Lùn mà công nhận Loko càng ngày càng có phong cách hơn các bạn haa!!","2014-07-21T06:41:51+0000",0,0,"660542767365888_663386223748209"
"322655967821238","Closeup","Tề Thiên Đại Thánh Tích kỳ thì khỏi nỏi rồi, càng ngay càng ra phong cách rock!! Hi vọng là tích kỳ sẽ #tutintoasang hơn trong vòng Liveshow !","2014-07-21T06:42:33+0000",0,0,"660542767365888_663386320414866"
